{
  "schema_version": 1,
  "kind": "tastecheck-release-gate",
  "roots": {
    "verifier": {
      "path": "[REDACTED:ABSOLUTE_PATH]",
      "sha256": "3a1bdfb164d345f6d2f9ced34b7e55210b5ce410dbd91690d84023257d935c13"
    },
    "artifact": {
      "path": "[REDACTED:ABSOLUTE_PATH]",
      "sha256": "3a1bdfb164d345f6d2f9ced34b7e55210b5ce410dbd91690d84023257d935c13"
    }
  },
  "execution": {
    "mode": "audit",
    "target_origin": "repo",
    "authenticated": false,
    "writes": false,
    "injection": false,
    "authorization": null
  },
  "browser_subjects": {
    "manifest_path": "skills/tastecheck-pass/assets/browser-subject-manifest.json",
    "manifest_sha256": "0e79c5e91e2ec9b71a819371333164a28ee5ada3b24aa564982131315f4d00f9",
    "required_viewports": [
      390,
      768,
      1280
    ],
    "routes": [
      "/"
    ],
    "states": [
      "default"
    ],
    "members": [
      {
        "id": "route:/|state:default|viewport:390",
        "route": "/",
        "state": "default",
        "viewport": 390
      },
      {
        "id": "route:/|state:default|viewport:768",
        "route": "/",
        "state": "default",
        "viewport": 768
      },
      {
        "id": "route:/|state:default|viewport:1280",
        "route": "/",
        "state": "default",
        "viewport": 1280
      }
    ]
  },
  "catalog": {
    "path": "skills/tastecheck-pass/assets/check-catalog.json",
    "sha256": "5e028d8c5d00a3190bcb562aa032d1118bd1c9e8ff29f8cc2031e4d27305901d",
    "check_ids": [
      "direction:system",
      "direction:gestalt-first",
      "foundation:color",
      "foundation:typography",
      "foundation:spacing",
      "foundation:theming",
      "structure:responsive-layout",
      "structure:component-states",
      "structure:form-ux",
      "structure:empty-states",
      "surface:micro-motion",
      "surface:data-viz",
      "surface:art-direction",
      "verification:a11y",
      "verification:cognitive-a11y",
      "verification:i18n",
      "verification:deslop-ui",
      "verification:humanize-copy",
      "browser:rendering",
      "browser:zoom-400",
      "browser:keyboard",
      "browser:theme-contrast",
      "browser:reduced-motion",
      "browser:cold-load",
      "browser:shadow-iframe",
      "gate:artifact-spec",
      "gate:required-evidence",
      "gate:blocker-handoff",
      "video:reading-hold",
      "video:motion-law",
      "video:readability-960x540",
      "video:audio-presence"
    ]
  },
  "subject_inventory": null,
  "artifact": {
    "type": "file",
    "identity": "unresolved",
    "sha256": "0000000000000000000000000000000000000000000000000000000000000000",
    "bytes": 0,
    "hash_verified": false,
    "dependency_manifest": null,
    "dependency_manifest_sha256": "0000000000000000000000000000000000000000000000000000000000000000",
    "dependency_manifest_hash_verified": false
  },
  "rows": [
    {
      "skill": "tastecheck-pass",
      "check_id": "direction:system",
      "status": "fail",
      "reason": "No ledger row was supplied for this closed check.",
      "remediation": "Run this check on the real artifact and attach complete evidence and provenance.",
      "evidence": null,
      "provenance": null,
      "review": null,
      "validation_errors": [
        "missing ledger row"
      ]
    },
    {
      "skill": "tastecheck-pass",
      "check_id": "direction:gestalt-first",
      "status": "fail",
      "reason": "No ledger row was supplied for this closed check.",
      "remediation": "Run this check on the real artifact and attach complete evidence and provenance.",
      "evidence": null,
      "provenance": null,
      "review": null,
      "validation_errors": [
        "missing ledger row"
      ]
    },
    {
      "skill": "tastecheck-pass",
      "check_id": "foundation:color",
      "status": "fail",
      "reason": "No ledger row was supplied for this closed check.",
      "remediation": "Run this check on the real artifact and attach complete evidence and provenance.",
      "evidence": null,
      "provenance": null,
      "review": null,
      "validation_errors": [
        "missing ledger row"
      ]
    },
    {
      "skill": "tastecheck-pass",
      "check_id": "foundation:typography",
      "status": "fail",
      "reason": "No ledger row was supplied for this closed check.",
      "remediation": "Run this check on the real artifact and attach complete evidence and provenance.",
      "evidence": null,
      "provenance": null,
      "review": null,
      "validation_errors": [
        "missing ledger row"
      ]
    },
    {
      "skill": "tastecheck-pass",
      "check_id": "foundation:spacing",
      "status": "fail",
      "reason": "No ledger row was supplied for this closed check.",
      "remediation": "Run this check on the real artifact and attach complete evidence and provenance.",
      "evidence": null,
      "provenance": null,
      "review": null,
      "validation_errors": [
        "missing ledger row"
      ]
    },
    {
      "skill": "tastecheck-pass",
      "check_id": "foundation:theming",
      "status": "fail",
      "reason": "No ledger row was supplied for this closed check.",
      "remediation": "Run this check on the real artifact and attach complete evidence and provenance.",
      "evidence": null,
      "provenance": null,
      "review": null,
      "validation_errors": [
        "missing ledger row"
      ]
    },
    {
      "skill": "tastecheck-pass",
      "check_id": "structure:responsive-layout",
      "status": "fail",
      "reason": "No ledger row was supplied for this closed check.",
      "remediation": "Run this check on the real artifact and attach complete evidence and provenance.",
      "evidence": null,
      "provenance": null,
      "review": null,
      "validation_errors": [
        "missing ledger row"
      ]
    },
    {
      "skill": "tastecheck-pass",
      "check_id": "structure:component-states",
      "status": "fail",
      "reason": "No ledger row was supplied for this closed check.",
      "remediation": "Run this check on the real artifact and attach complete evidence and provenance.",
      "evidence": null,
      "provenance": null,
      "review": null,
      "validation_errors": [
        "missing ledger row"
      ]
    },
    {
      "skill": "tastecheck-pass",
      "check_id": "structure:form-ux",
      "status": "fail",
      "reason": "No ledger row was supplied for this closed check.",
      "remediation": "Run this check on the real artifact and attach complete evidence and provenance.",
      "evidence": null,
      "provenance": null,
      "review": null,
      "validation_errors": [
        "missing ledger row"
      ]
    },
    {
      "skill": "tastecheck-pass",
      "check_id": "structure:empty-states",
      "status": "fail",
      "reason": "No ledger row was supplied for this closed check.",
      "remediation": "Run this check on the real artifact and attach complete evidence and provenance.",
      "evidence": null,
      "provenance": null,
      "review": null,
      "validation_errors": [
        "missing ledger row"
      ]
    },
    {
      "skill": "tastecheck-pass",
      "check_id": "surface:micro-motion",
      "status": "fail",
      "reason": "No ledger row was supplied for this closed check.",
      "remediation": "Run this check on the real artifact and attach complete evidence and provenance.",
      "evidence": null,
      "provenance": null,
      "review": null,
      "validation_errors": [
        "missing ledger row"
      ]
    },
    {
      "skill": "tastecheck-pass",
      "check_id": "surface:data-viz",
      "status": "fail",
      "reason": "No ledger row was supplied for this closed check.",
      "remediation": "Run this check on the real artifact and attach complete evidence and provenance.",
      "evidence": null,
      "provenance": null,
      "review": null,
      "validation_errors": [
        "missing ledger row"
      ]
    },
    {
      "skill": "tastecheck-pass",
      "check_id": "surface:art-direction",
      "status": "fail",
      "reason": "No ledger row was supplied for this closed check.",
      "remediation": "Run this check on the real artifact and attach complete evidence and provenance.",
      "evidence": null,
      "provenance": null,
      "review": null,
      "validation_errors": [
        "missing ledger row"
      ]
    },
    {
      "skill": "tastecheck-pass",
      "check_id": "verification:a11y",
      "status": "fail",
      "reason": "No ledger row was supplied for this closed check.",
      "remediation": "Run this check on the real artifact and attach complete evidence and provenance.",
      "evidence": null,
      "provenance": null,
      "review": null,
      "validation_errors": [
        "missing ledger row"
      ]
    },
    {
      "skill": "tastecheck-pass",
      "check_id": "verification:cognitive-a11y",
      "status": "fail",
      "reason": "No ledger row was supplied for this closed check.",
      "remediation": "Run this check on the real artifact and attach complete evidence and provenance.",
      "evidence": null,
      "provenance": null,
      "review": null,
      "validation_errors": [
        "missing ledger row"
      ]
    },
    {
      "skill": "tastecheck-pass",
      "check_id": "verification:i18n",
      "status": "fail",
      "reason": "No ledger row was supplied for this closed check.",
      "remediation": "Run this check on the real artifact and attach complete evidence and provenance.",
      "evidence": null,
      "provenance": null,
      "review": null,
      "validation_errors": [
        "missing ledger row"
      ]
    },
    {
      "skill": "tastecheck-pass",
      "check_id": "verification:deslop-ui",
      "status": "fail",
      "reason": "No ledger row was supplied for this closed check.",